{
  "protocol": "canghui.mobile-application-host.v0",
  "platform": "android",
  "packageKind": "android-application-package",
  "stage": "input-tree",
  "applicationId": "dev.canghui.mobile.replay",
  "lifecycleState": "active",
  "lifecycleEpoch": 4,
  "surfaceGeneration": 9,
  "signing": "unsigned",
  "deviceProof": "not-run",
  "permissions": [
    { "capability": "notifications", "state": "permission-required" },
    { "capability": "touch-input", "state": "granted" }
  ],
  "inputFiles": ["AndroidManifest.xml", "lib/arm64-v8a/libcanghui.so"],
  "limitations": ["unsigned consumer fixture", "no APK or device proof"]
}
